{
  "$schema": "https://json-schema.org/draft/2020-12/schema",
  "$id": "semgraph:categoryComparison/request",
  "title": "categoryComparison request",
  "description": "Categories as bars: without order they lie down, sorted by value; with an order they stand upright in that order. One row per category, computed in the warehouse (REQ-058): sum (a bar from zero), mean with sd (a diamond over a thin bar) or median with p25 and p75 (a dot in a wide bar). Give the time the values cover: window, period or day.",
  "type": "object",
  "additionalProperties": false,
  "required": [
    "semgraph",
    "metric",
    "measureType",
    "statistic",
    "points"
  ],
  "properties": {
    "semgraph": {
      "const": "categoryComparison"
    },
    "metric": {
      "description": "Identifier of the metric, e.g. creditLeads. Used as title when no title is given.",
      "type": "string",
      "pattern": "^[A-Za-z][A-Za-z0-9_]{0,63}$"
    },
    "title": {
      "description": "Title above the chart. States what is shown, not a conclusion.",
      "type": "string",
      "minLength": 1,
      "maxLength": 120
    },
    "measureType": {
      "description": "Kind of number: additive or unique for an average per day of a count, ratio for a mean or median of observations such as an amount per lead. Required until Domain Hub or the dbt YAML supplies it.",
      "enum": [
        "additive",
        "unique",
        "ratio"
      ]
    },
    "uniqueAggregation": {
      "description": "Required for unique counts: daily (the uniques per day; never summed) or overPeriod (the uniques over the whole block, counted in the warehouse; only as a total).",
      "enum": [
        "daily",
        "overPeriod"
      ]
    },
    "statistic": {
      "description": "The value per category: sum (an amount, a bar from zero), mean (a diamond with ±1 sd) or median (a dot with P25–P75). A row carries only the fields of this statistic.",
      "enum": [
        "sum",
        "mean",
        "median"
      ]
    },
    "ordered": {
      "description": "true for categories with an order, such as price ranges: upright bars in the order given. false (the default) for categories without order, such as provinces: lying bars, sorted by value. Never dates: a date axis is a line (REQ-001, REQ-002).",
      "type": "boolean",
      "default": false
    },
    "window": {
      "description": "The values cover the window of this many days that ends on the last complete day.",
      "type": "integer",
      "minimum": 1,
      "maximum": 364
    },
    "period": {
      "description": "The values cover this ISO calendar period: 2026-W40, 2026-09, 2026-Q3 or 2026. It must be over.",
      "type": "string",
      "pattern": "^[0-9]{4}(-W[0-9]{2}|-[0-9]{2}|-Q[1-4])?$"
    },
    "day": {
      "description": "The values are a snapshot on this day, such as the listings online.",
      "type": "string",
      "pattern": "^[0-9]{4}-[0-9]{2}-[0-9]{2}$"
    },
    "asOf": {
      "description": "The last complete day of the data. Yesterday in Brussels when absent.",
      "type": "string",
      "pattern": "^[0-9]{4}-[0-9]{2}-[0-9]{2}$"
    },
    "unit": {
      "description": "The unit around every number of the metric, e.g. { \"prefix\": \"€ \" } or { \"suffix\": \" d\" }.",
      "type": "object",
      "additionalProperties": false,
      "properties": {
        "prefix": {
          "type": "string",
          "minLength": 1,
          "maxLength": 6
        },
        "suffix": {
          "type": "string",
          "minLength": 1,
          "maxLength": 6
        }
      }
    },
    "format": {
      "description": "Output format. Only svg is available in v0.",
      "enum": [
        "svg",
        "png",
        "html",
        "widget"
      ],
      "default": "svg"
    },
    "locale": {
      "description": "Language of titles, labels and messages, e.g. en or nl-BE. Unknown locales fall back to English.",
      "type": "string",
      "pattern": "^[A-Za-z]{2,3}(-[A-Za-z0-9]{2,8})*$"
    },
    "context": {
      "description": "Provenance and status for the footer. Missing values are shown as unknown.",
      "type": "object",
      "additionalProperties": false,
      "properties": {
        "domain": {
          "type": "string",
          "minLength": 1,
          "maxLength": 80
        },
        "dataset": {
          "type": "string",
          "minLength": 1,
          "maxLength": 80
        },
        "owner": {
          "type": "string",
          "minLength": 1,
          "maxLength": 80
        },
        "reliability": {
          "type": "string",
          "minLength": 1,
          "maxLength": 80
        },
        "definitionUrl": {
          "type": "string",
          "minLength": 1,
          "maxLength": 500
        }
      }
    },
    "meta": {
      "description": "Metadata of the chart (REQ-010): the question that started it, references, the query, who asked and who built it, and the day it was compiled. Only what is given is shown (REQ-020).",
      "type": "object",
      "additionalProperties": false,
      "properties": {
        "question": {
          "description": "The question that started the chart.",
          "type": "string",
          "minLength": 1,
          "maxLength": 1000
        },
        "askedBy": {
          "description": "Who asked the question.",
          "type": "string",
          "minLength": 1,
          "maxLength": 80
        },
        "builtBy": {
          "description": "Who built the chart.",
          "type": "string",
          "minLength": 1,
          "maxLength": 80
        },
        "references": {
          "description": "Links to Jira, Slack or anything else.",
          "type": "array",
          "minItems": 1,
          "maxItems": 10,
          "items": {
            "type": "object",
            "additionalProperties": false,
            "required": [
              "url"
            ],
            "properties": {
              "label": {
                "type": "string",
                "minLength": 1,
                "maxLength": 120
              },
              "url": {
                "type": "string",
                "minLength": 1,
                "maxLength": 500
              }
            }
          }
        },
        "query": {
          "description": "The query behind the data, shown as written.",
          "type": "string",
          "minLength": 1,
          "maxLength": 10000
        },
        "compiledOn": {
          "description": "The day the chart was compiled. When absent, the day it is drawn, in Brussels.",
          "type": "string",
          "pattern": "^[0-9]{4}-[0-9]{2}-[0-9]{2}$"
        }
      }
    },
    "points": {
      "description": "One row per category, computed in the warehouse (REQ-058). A category without data has null: it is drawn as empty, never as zero.",
      "type": "array",
      "minItems": 1,
      "maxItems": 40,
      "items": {
        "type": "object",
        "additionalProperties": false,
        "required": [
          "category"
        ],
        "properties": {
          "category": {
            "description": "The name of the category, as the reader should see it.",
            "type": "string",
            "minLength": 1,
            "maxLength": 60
          },
          "sum": {
            "type": [
              "number",
              "null"
            ],
            "minimum": 0,
            "description": "The total of the block; null when the block has no data."
          },
          "mean": {
            "type": [
              "number",
              "null"
            ],
            "minimum": 0,
            "description": "The mean of the block; null when the block has no data."
          },
          "sd": {
            "description": "Sample standard deviation (n − 1, like STDDEV in BigQuery).",
            "type": "number",
            "minimum": 0
          },
          "n": {
            "description": "Number of observations behind the value, as counted where the value is computed (REQ-043).",
            "type": "integer",
            "minimum": 1
          },
          "median": {
            "type": [
              "number",
              "null"
            ],
            "minimum": 0,
            "description": "The median of the block; null when the block has no data."
          },
          "p25": {
            "description": "25th percentile (like PERCENTILE_CONT in BigQuery).",
            "type": "number",
            "minimum": 0
          },
          "p75": {
            "description": "75th percentile.",
            "type": "number",
            "minimum": 0
          }
        }
      }
    }
  }
}
